{
  "$schema": "https://json-schema.org/draft/2020-12/schema",
  "title": "morrow export container schema-v1",
  "description": "导出文件容器合同（02-contracts.md C-08），文件名 life-workspace_YYYY-MM-DD_schema-v1.json。BIGINT 已在上游 security_invoker 视图 SQL 端 cast 为 text；行级字段白名单由各导出视图定义，此处约束容器结构。credentials/token/receipt 响应等秘密字段不属于本容器。",
  "type": "object",
  "additionalProperties": false,
  "required": ["schema_version", "exported_at", "app_version", "workspace", "data", "counts", "integrity"],
  "properties": {
    "schema_version": { "const": 1 },
    "exported_at": {
      "type": "string",
      "pattern": "^[0-9]{4}-(0[1-9]|1[0-2])-(0[1-9]|[12][0-9]|3[01])T([01][0-9]|2[0-3]):[0-5][0-9]:[0-5][0-9](\\.[0-9]+)?(Z|[+-]([01][0-9]|2[0-3]):[0-5][0-9])$"
    },
    "app_version": { "type": "string", "minLength": 1, "maxLength": 100 },
    "workspace": {
      "type": "object",
      "additionalProperties": false,
      "required": ["owner_id", "timezone", "data_revision"],
      "properties": {
        "owner_id": {
          "type": "string",
          "pattern": "^[0-9a-f]{8}-[0-9a-f]{4}-[0-9a-f]{4}-[0-9a-f]{4}-[0-9a-f]{12}$"
        },
        "timezone": { "type": "string", "minLength": 1, "maxLength": 64 },
        "data_revision": { "type": "string", "pattern": "^(0|[1-9][0-9]*)$" }
      }
    },
    "data": {
      "type": "object",
      "additionalProperties": false,
      "required": ["life_data", "agent_advice", "activity_log", "automation_rules", "agent_clients", "workspace_settings"],
      "properties": {
        "life_data": { "type": "array", "items": { "type": "object" } },
        "agent_advice": { "type": "array", "items": { "type": "object" } },
        "activity_log": { "type": "array", "items": { "type": "object" } },
        "automation_rules": { "type": "array", "items": { "type": "object" } },
        "agent_clients": { "type": "array", "items": { "type": "object" } },
        "workspace_settings": { "type": "array", "items": { "type": "object" } }
      }
    },
    "counts": {
      "type": "object",
      "additionalProperties": false,
      "required": ["life_data", "agent_advice", "activity_log", "automation_rules", "agent_clients", "workspace_settings"],
      "properties": {
        "life_data": { "type": "integer", "minimum": 0 },
        "agent_advice": { "type": "integer", "minimum": 0 },
        "activity_log": { "type": "integer", "minimum": 0 },
        "automation_rules": { "type": "integer", "minimum": 0 },
        "agent_clients": { "type": "integer", "minimum": 0 },
        "workspace_settings": { "type": "integer", "minimum": 0 }
      }
    },
    "integrity": {
      "type": "object",
      "additionalProperties": false,
      "required": ["algorithm", "canonicalization", "data_sha256"],
      "properties": {
        "algorithm": { "const": "SHA-256" },
        "canonicalization": { "const": "RFC8785" },
        "data_sha256": { "type": "string", "pattern": "^[0-9a-f]{64}$" }
      }
    }
  }
}
