{"schema_version":1,"exported_at":"2026-09-28T13:49:21.159Z","app_version":"mvp-005-4624e4dc3237","workspace":{"owner_id":"00000000-0000-4000-8000-000000000001","timezone":"Asia/Shanghai","data_revision":"461"},"data":{"life_data":[{"id":"11111111-1111-4111-8111-111111111111","user_id":"00000000-0000-4000-8000-000000000001","module":"anchor","entity_key":"mvp005sample:anchor-wake","biz_date":"2026-09-28","payload":{"payload_v":1,"anchor_type":"wake","planned":true,"actual":"07:02"},"version":"2","source_type":"human","source_id":"00000000-0000-4000-8000-000000000001","created_at":"2026-09-28T00:00:00Z","updated_at":"2026-09-28T00:00:00Z","deleted_at":null},{"id":"22222222-2222-4222-8222-222222222222","user_id":"00000000-0000-4000-8000-000000000001","module":"day_type","entity_key":"mvp005sample:bigint-version-row","biz_date":"2026-09-27","payload":{"payload_v":1,"day_type":"workday","note":"version=2^53+1 保真样本"},"version":"9007199254740993","source_type":"human","source_id":"00000000-0000-4000-8000-000000000001","created_at":"2026-09-27T00:00:00Z","updated_at":"2026-09-27T00:00:00Z","deleted_at":null},{"id":"33333333-3333-4333-8333-333333333333","user_id":"00000000-0000-4000-8000-000000000001","module":"day_type","entity_key":"mvp005sample:tombstone-row","biz_date":"2026-09-26","payload":{"payload_v":1,"day_type":"rest"},"version":"4","source_type":"human","source_id":"00000000-0000-4000-8000-000000000001","created_at":"2026-09-26T00:00:00Z","updated_at":"2026-09-27T00:00:00Z","deleted_at":"2026-09-27T00:00:00Z"}],"agent_advice":[],"activity_log":[{"id":"55555555-5555-4555-8555-555555555555","user_id":"00000000-0000-4000-8000-000000000001","actor_type":"human","actor_id":"00000000-0000-4000-8000-000000000001","agent_id":null,"action":"human.exported","resource":"workspace","resource_id":null,"request_id":null,"metadata":{"device_id":"sample-device","biz_date":"2026-09-28"},"created_at":"2026-09-28T00:00:00Z"},{"id":"66666666-6666-4666-8666-666666666666","user_id":"00000000-0000-4000-8000-000000000001","actor_type":"agent","actor_id":"00000000-0000-4000-8000-000000000001","agent_id":"44444444-4444-4444-8444-444444444444","action":"agent.health_probe","resource":"workspace","resource_id":null,"request_id":null,"metadata":{"ok":true},"created_at":"2026-09-28T00:00:00Z"}],"automation_rules":[],"agent_clients":[{"id":"44444444-4444-4444-8444-444444444444","user_id":"00000000-0000-4000-8000-000000000001","name":"health-agent","type":"local","scopes":["system:health"],"enabled":true,"created_at":"2026-09-21T00:00:00Z","updated_at":"2026-09-21T00:00:00Z","last_seen_at":"2026-09-28T00:00:00Z","revoked_at":null,"version":"2"}],"workspace_settings":[{"user_id":"00000000-0000-4000-8000-000000000001","timezone":"Asia/Shanghai","tracking_started_on":"2026-09-21","schedule_history":[],"version":"3","created_at":"2026-09-21T00:00:00Z","updated_at":"2026-09-28T00:00:00Z"}]},"counts":{"life_data":3,"agent_advice":0,"activity_log":2,"automation_rules":0,"agent_clients":1,"workspace_settings":1},"integrity":{"algorithm":"SHA-256","canonicalization":"RFC8785","data_sha256":"682a017e080d5a476dfd83939ff746baa683c3067ad1897dfd787350147c38f2"}}